{
  "fixture_id": "lc_parallel_target_coexist",
  "category": "parallel",
  "description": "Two parallel deployment targets should COEXIST, not SUPERCEDES.",
  "input": {
    "event_stream": [
      {
        "event_id": "evt_pt1",
        "observed_at": "2026-07-01T10:00:00Z",
        "effective_at": "2026-07-01T10:00:00Z",
        "source": "release_team",
        "payload": {
          "entity_ref": "DEPLOY-LIST",
          "lifecycle_ref": "lc_deploy_list",
          "lifecycle_seq": 1,
          "adjudication_key": "DEPLOY-LIST:target:staging",
          "node_type": "Fact",
          "content": "Staging environment allowed",
          "state": "allowed",
          "claim_id": "deploy.list.staging",
          "claim_dimension": "target",
          "claim_scope": "staging",
          "alias_hints": null
        }
      },
      {
        "event_id": "evt_pt2",
        "observed_at": "2026-07-01T11:00:00Z",
        "effective_at": "2026-07-01T11:00:00Z",
        "source": "release_team",
        "payload": {
          "entity_ref": "DEPLOY-LIST",
          "lifecycle_ref": "lc_deploy_list",
          "lifecycle_seq": 2,
          "adjudication_key": "DEPLOY-LIST:target:canary",
          "node_type": "Fact",
          "content": "Canary environment also allowed",
          "state": "allowed",
          "claim_id": "deploy.list.canary",
          "claim_dimension": "target",
          "claim_scope": "canary",
          "alias_hints": null
        }
      }
    ]
  },
  "expected": {
    "deterministic": true,
    "checkpoints": [
      {
        "checkpoint_id": "cp_after_pt2",
        "after_event_id": "evt_pt2",
        "active_nodes": [
          "n_deploy_list_staging",
          "n_deploy_list_canary"
        ],
        "superseded_nodes": [],
        "pending_nodes": [],
        "relations": [],
        "quarantine": [],
        "assembler_must_include": [
          "n_deploy_list_staging",
          "n_deploy_list_canary"
        ]
      }
    ]
  },
  "rfc_reference": "contracts/05_phase1_lifecycle_schema.md §8 (COEXISTS)"
}
